18-08-20|Vim Setup|I did some good shit today
18-08-20|Vim|Learned how to setup and config vim. Now i can call myself  2x developer
18-08-20|Vim|Learned how to setup and config vim. Now i can call myself  2x developer
18-08-20|Vim|Learned how to setup and config vim. Now i can call myself  2x developer
23-11-20| Vim| I did some good shit today [ahs](ahsk)
23-11-20| LogSetup| I did some great things today. created a journal cli tool for me
120 - 10 - 24 |  Journal | This is where shit happens
120 - 10 - 24 |  Journal | jahfjashd
